<?xml version="1.0" encoding="UTF-8"?>
<!--
To change this license header, choose License Headers in Project Properties.
To change this template file, choose Tools | Templates
and open the template in the editor.
-->

<!DOCTYPE order SYSTEM 'bonanza.dtd'>

<order type="takeout">
    <customer> Wu</customer>
    <burger>
        <patty type="beef" />
        <cheeses top = "american" bottom="swiss" />
        <sauce type="ketchup" />
    </burger>
    
    <burger>
        <patty type="bison" />
        <cheeses top = "american" bottom="swiss" />
        <topping type = "lettuce" />
        <topping type = "tomato" />
    </burger>
    
    <burger>
        <patty type="turkey" />
        <cheeses bottom = "brie" />
        <topping type = "raw" />
        <topping type = "salsa" />
        <sauce type="fksauce" />
    </burger>
</order>
